{
  "slug": "spain",
  "country_name": "Spain",
  "iso2": "ES",
  "iso3": "ESP",
  "flag": "🇪🇸",
  "capital": "",
  "first_refresh": "2026-06",
  "tso": "REE (Red Eléctrica de España, Redeia Corporación)",
  "regulator": "CNMC (Comisión Nacional de los Mercados y la Competencia)",
  "admin": {
    "l1": {
      "label_en": "region",
      "label_short": "region",
      "count": 17
    }
  },
  "thresholds": {
    "r3_buckets": [
      {
        "label": "Capital-Intensive / High-Consequence",
        "icon": "🏭",
        "lower": 1.14,
        "upper": null,
        "voll_range": "€15-30/kWh",
        "color": "#941914"
      },
      {
        "label": "Industrial / Medium-Large Enterprise",
        "icon": "🔧",
        "lower": 1.12,
        "upper": 1.14,
        "voll_range": "€8-15/kWh",
        "color": "#aa4234"
      },
      {
        "label": "Commercial / Mixed",
        "icon": "🏪",
        "lower": 1.1,
        "upper": 1.12,
        "voll_range": "€3-8/kWh",
        "color": "#b8863a"
      },
      {
        "label": "Light-Rural / Agricultural",
        "icon": "🌾",
        "lower": 0.0,
        "upper": 1.1,
        "voll_range": "€1-3/kWh",
        "color": "#5d8563"
      }
    ],
    "high_consequence_threshold": 1.13
  }
}