{
  "slug": "poland",
  "country_name": "Poland",
  "iso2": "PL",
  "iso3": "POL",
  "flag": "🇵🇱",
  "capital": "",
  "first_refresh": "2026-05",
  "tso": "PSE (Polskie Sieci Elektroenergetyczne)",
  "regulator": "URE (Urząd Regulacji Energetyki)",
  "admin": {
    "l1": {
      "label_en": "region",
      "label_short": "region",
      "count": 16
    }
  }
}